[
  {
    "route_id": "one_day_story_route_sample",
    "name": "陈寿笔下的蜀汉记忆一日路线样例",
    "duration_hours": 6,
    "target_users": ["大众", "亲子", "文化深度游"],
    "transport": "待确认",
    "budget_level": "unknown",
    "stops": [
      {
        "spot_id": "wanjuanlou",
        "order": 1,
        "duration_min": 60,
        "narrative_stage": "寻源",
        "reason": "作为叙事起点，先认识陈寿与《三国志》。"
      }
    ],
    "data_status": "simulated"
  }
]

